{
  "schemaVersion": 1,
  "provenance": {
    "evidenceId": "codex-e-user-verified-aggregates-2026-10-15",
    "sourceKind": "user-verified-aggregate",
    "receivedOn": "2026-10-15",
    "observedAt": null,
    "payloadSha256": null
  },
  "scope": "aggregate-only",
  "aggregates": {
    "publishedIdentities": 209,
    "riskClass": "standard",
    "version": 1,
    "qaIdentities": 209,
    "qaChecks": 3135,
    "qaPassed": 2299,
    "qaWaived": 836,
    "passedPerIdentity": 11,
    "waivedPerIdentity": 4,
    "sourceRecords": 210,
    "sourceIdentities": 209
  },
  "rows": []
}
